{"manifest_version":3,"component_profile":"camera-raw-70338-v1","acquisition":{"backend":"rust-local","profile":"local-v7-ckey-root-nz-v1","index_layouts":["paged","paged","paged","paged","paged","paged","paged","paged","paged","paged","paged","paged","paged","paged","paged","paged"],"root_layout":"header-50893-v2","offline":true,"complete_ckey_md5":true,"ekey_validation":"prefix9","limits":{"resident_bytes":805306368,"scratch_bytes":536870912,"combined_bytes":1073741824,"build_info_bytes":262144,"build_info_rows":4096,"path_bytes":4096,"config_bytes":262144,"config_lines":8192,"config_keys":4096,"directory_entries":65536,"index_files":4096,"index_bytes":67108864,"index_entries":2000000,"index_pages":131072,"encoding_bytes":268435456,"encoding_pages":65536,"encoding_page_bytes":65536,"encoding_espec_bytes":16777216,"encoding_tail_bytes":134217728,"encoding_entries":4000000,"encoding_keys":8000000,"root_bytes":268435456,"root_header_bytes":4096,"root_blocks":65536,"root_entries":4000000,"archive_span_bytes":268435456,"file_bytes":4096,"candidate_attempts":64,"blte_frames":65536}},"scope":"complete_camera_files","status":"complete","product":"wow_classic_beta","build":70338,"locale":"enUS","extractor":"forever-camera-extract","extractor_version":"0.1.0","oracle_commit":"02245dcd245e7433e524577656177723d3e4992e","schema_catalog":{"id":"wowdbdefs-70338-v1","source_commit":"d6f50d4f351193e84226aa62a36faa0f58528afa","source_manifest_blob":"8a5d8122f312ae6a9564e8286fdc491831fecc22","source_manifest_sha256":"4314266fe055e30207e1c39498a7a31058a1aa2ab6cd674726491b313d135265","facts_sha256":"9fb8852f7ec15a5721ff17da4708970eacb54c5e79c4e78703891a2468905405","table_hash":3268345337,"layout_hash":2348643627,"file_data_id":1294214,"physical_field":3,"field_name":"FileDataID","field_type":"u32","file_field_count":5,"decoded_scalar_count":7,"external_id":true,"definition_path":"definitions/CinematicCamera.dbd","definition_blob":"3676f4e583d5c53c4eda065db9c322f9d45921f0","definition_sha256":"21f07cf5a2cdba30bec06895cb68e7467b58ab20cbee474f256473d2f70ca9d6"},"discovery_policy":"direct_rows_u32_field3_v1","max_source_bytes":16777216,"max_file_bytes":16777216,"max_files":4096,"max_total_bytes":268435456,"offline":true,"downloaded_bytes":0,"paths_redacted":true,"full_client_extraction":false,"m2_parsed":false,"waypoints_generated":false,"runtime_accepted":false,"source":{"name":"CinematicCamera.db2","file_id":1294214,"relative_path":"dbc/enUS/CinematicCamera.db2","layout_hash":2348643627,"status":"complete","bytes":488,"sha256":"ad64198d2b638f4f0bd7e50614eac46dd265cce25e772325be48d258c71e66b4","error_code":null,"direct_records":3,"unique_file_ids":2,"file_id_set_sha256":"527434a55f745fd61afdc8f3114f88e538050f3ea6a0e68258c6403f9cee021c"},"cameras":[{"file_id":11,"relative_path":"cameras/FILE0000000B.xxx","status":"complete","bytes":22,"sha256":"9be5f7201018ef6cfe9c152df56e82a337962e9831c42dc6e89d5f45b2d7b42a","error_code":null},{"file_id":12,"relative_path":"cameras/FILE0000000C.xxx","status":"complete","bytes":22,"sha256":"ed8fab0f9a588e21ddf1dfc30b89791ff9db42c028865fefc7f4a1eeaac86b39","error_code":null}],"integrity":{"file_count":3,"total_bytes":532,"inventory_sha256":"251a5f39beb6f516a584ab45f7944881fe5741cfd070f962b2e48f46a7049e72"}}
